{
  "askOfNext": "Review the change against the plan, the decisions and AGENTS.md.",
  "changedFiles": [
    {
      "added": 27,
      "path": "README.md",
      "removed": 0,
      "run": "r1"
    },
    {
      "added": 15,
      "path": "index.js",
      "removed": 12,
      "run": "r1"
    },
    {
      "added": 33,
      "path": "lib/charset.js",
      "removed": 5,
      "run": "r1"
    },
    {
      "added": 33,
      "path": "lib/language.js",
      "removed": 5,
      "run": "r1"
    },
    {
      "added": 32,
      "path": "lib/mediaType.js",
      "removed": 4,
      "run": "r1"
    }
  ],
  "cost": {
    "cachedTokens": 726528,
    "inputTokens": 805736,
    "outputTokens": 43248,
    "usd": 0.3918
  },
  "createdAt": "2026-10-29T17:23:32.661Z",
  "decisions": [
    {
      "id": "D1",
      "text": "preferred tie-break only considers q-value equality, overriding specificity/order, matching existing encodings implementation"
    }
  ],
  "diffRef": {
    "base": "7ad79a9a0df1da2f1e5c8fcd2b7e5c6ef2881cdb",
    "head": "17b71027c19bb16ddd7e9538067a69fcdf55a00c"
  },
  "done": [
    "Verification by the daemon: 1 passed, 0 failed"
  ],
  "from": {
    "adapter": "stint-agent",
    "endedBy": "completed",
    "host": "baseten",
    "model": "muse-spark-open",
    "role": "implementer",
    "run": "r1",
    "vendor": "meta"
  },
  "hash": "sha256:647ffef4a6ec3973b3762550f78bc4ccceb39cc42de49e293fdab70aba765559",
  "leftOut": [],
  "open": [],
  "refusals": [
    {
      "action": "node -e \" var Negotiator = require('./index'); function test() { var req = { headers: { accept: 'text/html, application/json' } }; var n = new Negotiator(req); console.log('mediaTypes preferred', n...",
      "by": "stint-rules",
      "reason": "// is outside the worktree"
    },
    {
      "action": "node -e \" var Negotiator = require('./index'); function check() { // mediaTypes with q difference preferred should not override var req = { headers: { accept: 'text/html;q=0.5, application/json' } ...",
      "by": "stint-rules",
      "reason": "// is outside the worktree"
    }
  ],
  "risks": [],
  "summary": "Implemented server-preference tie-break for mediaTypes/mediaType, languages/language and charsets/charset. - `lib/mediaType.js`, `lib/language.js`, `lib/charset.js`: added third `preferred` argument, comparator that checks `q` first then `preferred` index, falling back to `s/o/i`; stored original `value` on priority specs to match preferred list case-sensitively (mirroring `lib/encoding.js`). -...",
  "task": "T-0001",
  "verification": {
    "command": "npm test",
    "durationMs": 331,
    "exitCode": 0,
    "failed": 0,
    "passed": 1,
    "runBy": "daemon",
    "status": "green"
  },
  "version": "stint.handoff/1"
}
