{
  "askOfNext": "Review the change against the plan, the decisions and AGENTS.md.",
  "changedFiles": [],
  "cost": {
    "cachedTokens": 9856,
    "inputTokens": 26518,
    "outputTokens": 4653,
    "usd": 0.0421
  },
  "createdAt": "2026-10-29T16:56:47.429Z",
  "decisions": [],
  "diffRef": {
    "base": "f28c64a9ccbb5cf15f28afd75ba15df7cfc6f0bf",
    "head": "ce5f44b9c1baed51bd492fa68cc2dc8e5cfd97eb"
  },
  "done": [
    "Verification by the daemon: 1 passed, 0 failed"
  ],
  "from": {
    "adapter": "stint-agent",
    "endedBy": "completed",
    "host": "baseten",
    "model": "muse-spark-open",
    "role": "implementer",
    "run": "r1",
    "vendor": "meta"
  },
  "hash": "sha256:9aad7ae05491d77c19648c0c02edfd1dd28e792c45a8481807b7d7456d52262f",
  "leftOut": [],
  "open": [],
  "refusals": [],
  "risks": [],
  "summary": "stint-agent completed after 11 tool calls.",
  "task": "T-0001",
  "verification": {
    "command": "npm run test:nodejs && npm run test:edge",
    "durationMs": 2872,
    "exitCode": 0,
    "failed": 0,
    "passed": 1,
    "runBy": "daemon",
    "status": "green"
  },
  "version": "stint.handoff/1"
}
