{
  "askOfNext": "Review the change against the plan, the decisions and AGENTS.md.",
  "changedFiles": [],
  "cost": {
    "cachedTokens": 57600,
    "inputTokens": 94960,
    "outputTokens": 5294,
    "usd": 0.0778
  },
  "createdAt": "2026-10-29T16:41:26.948Z",
  "decisions": [],
  "diffRef": {
    "base": "0299adc48e726bf80405d164b935071dc4433303",
    "head": "d0ad1293de2705076eab610796d3e6f7276d1f3d"
  },
  "done": [
    "Verification by the daemon: 1 passed, 0 failed"
  ],
  "from": {
    "adapter": "stint-agent",
    "endedBy": "completed",
    "host": "baseten",
    "model": "muse-spark-open",
    "role": "implementer",
    "run": "r1",
    "vendor": "meta"
  },
  "hash": "sha256:d559eb22f34c15c5d9a242bc232a370640a580e4ab8411236f6050eb3f5bdc24",
  "leftOut": [],
  "open": [],
  "refusals": [],
  "risks": [],
  "summary": "stint-agent completed after 18 tool calls.",
  "task": "T-0001",
  "verification": {
    "command": "npm test",
    "durationMs": 500,
    "exitCode": 0,
    "failed": 0,
    "passed": 1,
    "runBy": "daemon",
    "status": "green"
  },
  "version": "stint.handoff/1"
}
