{
  "askOfNext": "Review the change against the plan, the decisions and AGENTS.md.",
  "changedFiles": [
    {
      "added": 4,
      "path": "src/lib/audit.ts",
      "removed": 0,
      "run": "r1"
    },
    {
      "added": 3,
      "path": "src/routes/audit.ts",
      "removed": 0,
      "run": "r1"
    },
    {
      "added": 29,
      "path": "test/audit.test.ts",
      "removed": 0,
      "run": "r1"
    }
  ],
  "cost": {
    "cachedTokens": 188582,
    "inputTokens": 240630,
    "outputTokens": 2233,
    "usd": 0.1045
  },
  "createdAt": "2026-10-26T18:10:26.083Z",
  "decisions": [],
  "diffRef": {
    "base": "be1bee8d153659647701b8f5886f0a5c73cf276a",
    "head": "f77ba333dd96cba5ce9cea8afb836962e6f24d35"
  },
  "done": [
    "Verification by the daemon: 30 passed, 0 failed"
  ],
  "from": {
    "adapter": "muse-code",
    "endedBy": "capped",
    "host": "local-cli",
    "model": "muse-spark-1.3",
    "role": "implementer",
    "run": "r1",
    "sessionId": "01a17967-bd83-7ac0-8c1c-730433fa3876",
    "vendor": "meta"
  },
  "hash": "sha256:e35b0253423a6077d59db50bfb63c0fa6e6cf5df6f8e53377a1a7776fb9335c7",
  "leftOut": [],
  "open": [],
  "refusals": [],
  "risks": [],
  "summary": "muse-code capped after 13 tool calls.",
  "task": "T-0001",
  "verification": {
    "command": "bun run test",
    "durationMs": 1261,
    "exitCode": 0,
    "failed": 0,
    "passed": 30,
    "runBy": "daemon",
    "status": "green"
  },
  "version": "stint.handoff/1"
}
