{
  "askOfNext": "Review the change against the plan, the decisions and AGENTS.md.",
  "changedFiles": [
    {
      "added": 27,
      "path": "README.md",
      "removed": 0,
      "run": "r3"
    },
    {
      "added": 30,
      "path": "index.js",
      "removed": 14,
      "run": "r3"
    },
    {
      "added": 72,
      "path": "lib/charset.js",
      "removed": 3,
      "run": "r3"
    },
    {
      "added": 72,
      "path": "lib/language.js",
      "removed": 3,
      "run": "r3"
    },
    {
      "added": 72,
      "path": "lib/mediaType.js",
      "removed": 3,
      "run": "r3"
    }
  ],
  "cost": {
    "cachedTokens": 964941,
    "inputTokens": 1021180,
    "outputTokens": 15869,
    "usd": 0.2944
  },
  "createdAt": "2026-10-29T14:05:42.862Z",
  "decisions": [
    {
      "id": "D1",
      "text": "preferred breaks ties only among equal q-values and never overrides q, matching the encodings comparator"
    },
    {
      "id": "D2",
      "text": "preferred matching is case-insensitive while returning the provided casing"
    }
  ],
  "diffRef": {
    "base": "c1d2e99d9876a18ff97b55b340e36c39960ec74c",
    "head": "c891a4cc7dcdc916f106fdfcc3bcc4233ccdc42b"
  },
  "done": [
    "Verification by the daemon: 1 passed, 0 failed"
  ],
  "from": {
    "adapter": "codex",
    "endedBy": "completed",
    "host": "meta-api",
    "model": "muse-spark-1.3",
    "role": "implementer",
    "run": "r3",
    "sessionId": "01a187f9-4b5f-7180-8458-47f87908186e",
    "vendor": "openai"
  },
  "hash": "sha256:34f607eb7fdce4d9aed4618bf6966dba82a846746c343bdf88fbb0b6132a31e0",
  "leftOut": [],
  "open": [],
  "refusals": [],
  "risks": [],
  "summary": "Implemented `{ preferred }` tie-break for media types, languages and charsets, mirroring encodings. - `lib/mediaType.js`, `lib/language.js`, `lib/charset.js`: added third `preferred` param with q-first comparator; preferred only reorders equal q-values, falling back to specificity/order otherwise; matching is case-insensitive and returns provided casing. - `index.js`: `mediaType(s)`, `language(...",
  "task": "T-0001",
  "verification": {
    "command": "npm test",
    "durationMs": 278,
    "exitCode": 0,
    "failed": 0,
    "passed": 1,
    "runBy": "daemon",
    "status": "green"
  },
  "version": "stint.handoff/1"
}
