{
  "askOfNext": "Review the change against the plan, the decisions and AGENTS.md.",
  "changedFiles": [
    {
      "added": 47,
      "path": "src/scale.test.ts",
      "removed": 0,
      "run": "r1"
    },
    {
      "added": 19,
      "path": "src/index.ts",
      "removed": 0,
      "run": "r1"
    },
    {
      "added": 12,
      "path": "README.md",
      "removed": 0,
      "run": "r1"
    }
  ],
  "cost": {
    "cachedTokens": 288136,
    "inputTokens": 328475,
    "outputTokens": 2912,
    "usd": 0.1082
  },
  "createdAt": "2026-10-29T15:55:25.560Z",
  "decisions": [
    {
      "id": "D1",
      "text": "scale() takes (StringValue | number, number) and validates factor as a finite number, reusing toMilliseconds for the ..."
    },
    {
      "id": "D1",
      "text": "`toSeconds` throws for non-string/non-number input and for non-finite numbers, mirroring the error style of `ms()` an..."
    },
    {
      "id": "D1",
      "text": "add() follows toSeconds() conventions - each argument is a StringValue or finite number of milliseconds, strings go t..."
    },
    {
      "id": "D1",
      "text": "clamp reuses the shared toMilliseconds helper, parameterized with the caller name so its errors say clamp() while add..."
    },
    {
      "id": "D2",
      "text": "clamp is Math.min(Math.max(value, min), max) with no min<=max validation; inverted bounds yield max"
    }
  ],
  "diffRef": {
    "base": "88f1c3ecfedcc13b15577261adcb26633e07702e",
    "head": "f88372a391c6dfea52ce5ceb0fdc42bab65076ca"
  },
  "done": [
    "Verification by the daemon: 1 passed, 0 failed"
  ],
  "from": {
    "adapter": "muse-code",
    "endedBy": "completed",
    "host": "local-cli",
    "model": "muse-spark-1.3",
    "role": "implementer",
    "run": "r1",
    "sessionId": "01a1885e-c5a6-7821-9c90-cd6977261e55",
    "vendor": "meta"
  },
  "hash": "sha256:c5477f7929091082840d847c64d4b792413f45a7808f1b8f34e0c2fb1058a656",
  "leftOut": [
    "Trimmed to fit 600 tokens: 2 items and file entries are not listed; the diff and the task's log have them"
  ],
  "open": [],
  "refusals": [],
  "risks": [],
  "summary": "Done. `scale(value, factor)` is exported from [src/index.ts](<clone>/.stint/worktrees/T-0005...",
  "task": "T-0005",
  "verification": {
    "command": "npm run test:nodejs && npm run test:edge",
    "durationMs": 1703,
    "exitCode": 0,
    "failed": 0,
    "passed": 1,
    "runBy": "daemon",
    "status": "green"
  },
  "version": "stint.handoff/1"
}
