{
  "askOfNext": "Review the change against the plan, the decisions and AGENTS.md.",
  "changedFiles": [
    {
      "added": 5,
      "path": "src/lib/audit.ts",
      "removed": 1,
      "run": "r1"
    },
    {
      "added": 3,
      "path": "src/routes/audit.ts",
      "removed": 0,
      "run": "r1"
    },
    {
      "added": 21,
      "path": "test/audit.test.ts",
      "removed": 0,
      "run": "r1"
    }
  ],
  "cost": {
    "cachedTokens": 185510,
    "inputTokens": 236103,
    "outputTokens": 2360,
    "usd": 0.1029
  },
  "createdAt": "2026-10-26T18:21:12.661Z",
  "decisions": [],
  "diffRef": {
    "base": "be1bee8d153659647701b8f5886f0a5c73cf276a",
    "head": "37d8b23d7c35b6c31dcedaedb2f6e1d724477053"
  },
  "done": [
    "Verification by the daemon: 29 passed, 0 failed"
  ],
  "from": {
    "adapter": "muse-code",
    "endedBy": "capped",
    "host": "local-cli",
    "model": "muse-spark-1.3",
    "role": "implementer",
    "run": "r1",
    "sessionId": "01a17971-9a82-7ce1-a1e2-c810a9bb75b2",
    "vendor": "meta"
  },
  "hash": "sha256:73b7bb489b3c324a11159638c5d06ac6aa604a87a3bad3663419c886bba7501e",
  "leftOut": [],
  "open": [],
  "refusals": [],
  "risks": [],
  "summary": "src/lib/audit.ts adds AuditLog.toJson returning AuditEntry list with EXPORT_LIMIT, reused by toCsv. src/routes/audit.ts makes auditRoutes GET / return c.json via toJson when query format=json else CSV, both with X-Tenant filter. test/audit.test.ts adds JSON content and JSON tenant-filter tests. The diff cuts off inside the existing CSV filter test, so its completion is not visible.",
  "task": "T-0001",
  "verification": {
    "command": "bun run test",
    "durationMs": 1474,
    "exitCode": 0,
    "failed": 0,
    "passed": 29,
    "runBy": "daemon",
    "status": "green"
  },
  "version": "stint.handoff/1"
}
