{
  "askOfNext": "Review the change against the plan, the decisions and AGENTS.md.",
  "changedFiles": [],
  "cost": {
    "cachedTokens": 219799,
    "inputTokens": 271954,
    "outputTokens": 8783,
    "usd": 0.1421
  },
  "createdAt": "2026-10-27T11:47:41.874Z",
  "decisions": [],
  "diffRef": {
    "base": "be1bee8d153659647701b8f5886f0a5c73cf276a",
    "head": "c0239bebca1be639032bd73a8b10c0a38e4895e4"
  },
  "done": [
    "Verification by the daemon: 27 passed, 0 failed"
  ],
  "from": {
    "adapter": "muse-code",
    "endedBy": "capped",
    "host": "local-cli",
    "model": "muse-spark-1.3",
    "role": "implementer",
    "run": "r1",
    "sessionId": "01a17d2e-97f3-7721-901f-5ede10967eb7",
    "vendor": "meta"
  },
  "hash": "sha256:a0f41c6d4ee9d8a9bc29346e95e8374704e86e56060bf9d0ebaeb397a0eba8a5",
  "leftOut": [],
  "open": [],
  "refusals": [],
  "risks": [],
  "summary": "muse-code capped after 25 tool calls.",
  "task": "T-0001",
  "verification": {
    "command": "bun run test",
    "durationMs": 1303,
    "exitCode": 0,
    "failed": 0,
    "passed": 27,
    "runBy": "daemon",
    "status": "green"
  },
  "version": "stint.handoff/1"
}
