{
  "askOfNext": "Next: Held-out scenarios failed. Their source is held out; the names are all you get..",
  "changedFiles": [
    {
      "added": 6,
      "path": "lib/mediaType.js",
      "removed": 1,
      "run": "r1"
    }
  ],
  "cost": {
    "cachedTokens": 0,
    "estimated": true,
    "inputTokens": 0,
    "outputTokens": 0,
    "usd": null
  },
  "createdAt": "2026-10-29T15:25:39.848Z",
  "decisions": [],
  "diffRef": {
    "base": "f64acae5bf34228088b320fa17060975df6fea34",
    "head": "3c877df5d0a0e8ed3cb1027096a578e5dcc74dd6"
  },
  "done": [
    "Verification by the daemon: 0 passed, 1 failed"
  ],
  "from": {
    "adapter": "muse-code",
    "endedBy": "killed",
    "host": "local-cli",
    "model": "muse-spark-1.3",
    "role": "implementer",
    "run": "r1",
    "sessionId": "01a18843-707e-7753-9b59-bcef58c84c0b",
    "vendor": "meta"
  },
  "hash": "sha256:defbfb21e355ba3a636d9455ad1b4ed845cb772d0cb96f36e2bce27952dc4289",
  "leftOut": [],
  "open": [
    "Held-out scenarios failed. Their source is held out; the names are all you get."
  ],
  "refusals": [],
  "risks": [],
  "summary": "muse-code killed after 10 tool calls.",
  "task": "T-0001",
  "to": {
    "adapter": "claude-code",
    "role": "implementer"
  },
  "verification": {
    "command": "npm test",
    "durationMs": 581,
    "exitCode": 2,
    "failed": 1,
    "passed": 0,
    "runBy": "daemon",
    "status": "red"
  },
  "version": "stint.handoff/1"
}
