{
  "askOfNext": "Review the change against the plan, the decisions and AGENTS.md.",
  "changedFiles": [],
  "cost": {
    "cachedTokens": 852608,
    "inputTokens": 945479,
    "outputTokens": 62833,
    "usd": 0.511
  },
  "createdAt": "2026-10-29T17:46:01.266Z",
  "decisions": [],
  "diffRef": {
    "base": "db58522a52cd44e7feccfbc704ec2294046e73ac",
    "head": "8cce4795ad9a05cb9aa81615b2e530b309ef06a8"
  },
  "done": [
    "Verification by the daemon: 1 passed, 0 failed"
  ],
  "from": {
    "adapter": "stint-agent",
    "endedBy": "capped",
    "host": "baseten",
    "model": "muse-spark-open",
    "role": "implementer",
    "run": "r1",
    "vendor": "meta"
  },
  "hash": "sha256:f562eef42b30134043f4de37db0f8184b778ceff4ee97e1f1e09f97e038c6703",
  "leftOut": [],
  "open": [],
  "refusals": [
    {
      "action": "node -e \" const Joi=require('joi'); let s=Joi.object({expectBody: Joi.alternatives().try(Joi.string().allow(''), Joi.object().instance(RegExp))}); // test .unknown behavior let s2=Joi.object({a:Joi...",
      "by": "stint-rules",
      "reason": "// is outside the worktree"
    }
  ],
  "risks": [],
  "summary": "stint-agent capped after 50 tool calls.",
  "task": "T-0001",
  "verification": {
    "command": "npm test",
    "durationMs": 74720,
    "exitCode": 0,
    "failed": 0,
    "passed": 1,
    "runBy": "daemon",
    "status": "green"
  },
  "version": "stint.handoff/1"
}
