{
  "askOfNext": "Review the change against the plan, the decisions and AGENTS.md.",
  "changedFiles": [
    {
      "added": 11,
      "path": "README.md",
      "removed": 0,
      "run": "r1"
    },
    {
      "added": 41,
      "path": "src/add.test.ts",
      "removed": 0,
      "run": "r1"
    },
    {
      "added": 36,
      "path": "src/index.ts",
      "removed": 0,
      "run": "r1"
    }
  ],
  "cost": {
    "cachedTokens": 421979,
    "inputTokens": 465268,
    "outputTokens": 2908,
    "usd": 0.1319
  },
  "createdAt": "2026-10-29T15:46:18.357Z",
  "decisions": [
    {
      "id": "D1",
      "text": "add() follows toSeconds() conventions - each argument is a StringValue or finite number of milliseconds, strings go through parse() (NaN propagates), non-finite numbers and non-string/non-number types"
    },
    {
      "id": "D1",
      "text": "`toSeconds` throws for non-string/non-number input and for non-finite numbers, mirroring the error style of `ms()` and `format()`."
    }
  ],
  "diffRef": {
    "base": "bbe718823251393e5339d19f4b7e01cab95d2540",
    "head": "d5201ef4bf16a2225ea04ceb7278996a23765597"
  },
  "done": [
    "Verification by the daemon: 1 passed, 0 failed"
  ],
  "from": {
    "adapter": "muse-code",
    "endedBy": "completed",
    "host": "local-cli",
    "model": "muse-spark-1.3",
    "role": "implementer",
    "run": "r1",
    "sessionId": "01a18856-4a9a-79e0-9164-9cf45f224cd2",
    "vendor": "meta"
  },
  "hash": "sha256:b42c956c61271242cceebd082dbceb7dfb73b096b692637890dda2204828c56b",
  "leftOut": [],
  "open": [],
  "refusals": [],
  "risks": [],
  "summary": "Done. Exported `add(a, b)` from [index.ts](<clone>/.stint/worktrees/T-0002-r1/src/index.ts), documented it in the README, and added [add.test.ts](/private/tmp/claude-501/-Users-user-hackathon-meta-stint/85271cac-66bf-4d93-b566-e59fd7677058/scra...",
  "task": "T-0002",
  "verification": {
    "command": "npm run test:nodejs && npm run test:edge",
    "durationMs": 1727,
    "exitCode": 0,
    "failed": 0,
    "passed": 1,
    "runBy": "daemon",
    "status": "green"
  },
  "version": "stint.handoff/1"
}
