{
  "askOfNext": "Check the unknown step first. Next: Held-out scenarios failed: src/holdout-unit.test.ts. Their source is held out; the names are all you get..",
  "changedFiles": [],
  "cost": {
    "cachedTokens": 0,
    "estimated": true,
    "inputTokens": 0,
    "outputTokens": 0,
    "usd": null
  },
  "createdAt": "2026-10-29T14:40:26.861Z",
  "decisions": [],
  "diffRef": {
    "base": "2b7d313ec3fe95ad1d49aa2556e128d8dce4b0b6",
    "head": "43bc5e7deb25dab0338bc2d23f26cc112834a680"
  },
  "done": [
    "Verification by the daemon: 1 passed, 0 failed"
  ],
  "from": {
    "adapter": "muse-code",
    "endedBy": "killed",
    "host": "local-cli",
    "model": "muse-spark-1.3",
    "role": "implementer",
    "run": "r1",
    "sessionId": "01a18818-d50a-72b2-8de4-9199a35053a9",
    "vendor": "meta"
  },
  "hash": "sha256:9d57a281185c8cc38fdd82f512279f149131245ad4e90abb60d380a0e37aba99",
  "leftOut": [
    "In-flight step unknown: write_todos"
  ],
  "open": [
    "Held-out scenarios failed: src/holdout-unit.test.ts. Their source is held out; the names are all you get."
  ],
  "refusals": [],
  "risks": [],
  "summary": "muse-code killed after 10 tool calls.",
  "task": "T-0001",
  "to": {
    "adapter": "claude-code",
    "role": "implementer"
  },
  "verification": {
    "command": "npm run test:nodejs && npm run test:edge",
    "durationMs": 2779,
    "exitCode": 0,
    "failed": 0,
    "passed": 1,
    "runBy": "daemon",
    "status": "red"
  },
  "version": "stint.handoff/1"
}
